{
  "meta": {
    "generatedAt": "2026-01-08",
    "generator": "cursor-gpt",
    "source": "theme/gstore",
    "notes": "Documento focado nos principais subsistemas do tema (checkout/pagamentos, frete, store-info/placeholders, setup/admin, category-filter e api-visualizer)."
  },
  "rules": [
    "Não inventar endpoints/hooks que não existam no código.",
    "Marcar handoff quando houver transição clara de camada (PHP/WP -> React).",
    "Preferir nós por subsistema (classes/arquivos/endpoints) em vez de listar todas as funções do functions.php."
  ],
  "project": {
    "name": "CAC Armas Gstore",
    "type": "theme",
    "version": "1.5.1",
    "description": "Tema personalizado da CAC Armas otimizado para WooCommerce (inclui gateways Blu, frete customizado, store-info.json, setup/admin e integrações de frontend)."
  },
  "entities": [
    {
      "id": "php:file:style.css",
      "layer": "php",
      "kind": "file",
      "title": "style.css (Theme Header)",
      "path": "style.css",
      "summary": "Metadados do tema + estilos legados (versão 1.5.1).",
      "tags": ["theme", "css"]
    },
    {
      "id": "php:file:functions.php",
      "layer": "php",
      "kind": "file",
      "title": "functions.php (bootstrap do tema)",
      "path": "functions.php",
      "summary": "Bootstrap do tema: registra supports, enqueues, hooks WooCommerce, endpoints AJAX e carrega módulos em inc/.",
      "tags": ["bootstrap", "woocommerce", "admin", "frontend"]
    },

    {
      "id": "wp:hook:after_setup_theme",
      "layer": "wordpress",
      "kind": "hook",
      "title": "after_setup_theme"
    },
    {
      "id": "wp:hook:wp_enqueue_scripts",
      "layer": "wordpress",
      "kind": "hook",
      "title": "wp_enqueue_scripts"
    },
    {
      "id": "wp:hook:send_headers",
      "layer": "wordpress",
      "kind": "hook",
      "title": "send_headers"
    },
    {
      "id": "wp:hook:init",
      "layer": "wordpress",
      "kind": "hook",
      "title": "init"
    },
    {
      "id": "wp:hook:admin_menu",
      "layer": "wordpress",
      "kind": "hook",
      "title": "admin_menu"
    },
    {
      "id": "wp:hook:admin_init",
      "layer": "wordpress",
      "kind": "hook",
      "title": "admin_init"
    },
    {
      "id": "wp:hook:admin_enqueue_scripts",
      "layer": "wordpress",
      "kind": "hook",
      "title": "admin_enqueue_scripts"
    },
    {
      "id": "wp:hook:rest_api_init",
      "layer": "wordpress",
      "kind": "hook",
      "title": "rest_api_init"
    },
    {
      "id": "wp:hook:template_redirect",
      "layer": "wordpress",
      "kind": "hook",
      "title": "template_redirect"
    },
    {
      "id": "wp:hook:shutdown",
      "layer": "wordpress",
      "kind": "hook",
      "title": "shutdown"
    },

    {
      "id": "wp:hook:woocommerce_payment_gateways",
      "layer": "wordpress",
      "kind": "hook",
      "title": "woocommerce_payment_gateways (filter)"
    },
    {
      "id": "wp:hook:woocommerce_available_payment_gateways",
      "layer": "wordpress",
      "kind": "hook",
      "title": "woocommerce_available_payment_gateways (filter)"
    },
    {
      "id": "wp:hook:woocommerce_order_actions",
      "layer": "wordpress",
      "kind": "hook",
      "title": "woocommerce_order_actions (filter)"
    },
    {
      "id": "wp:hook:woocommerce_order_action_gstore_blu_refresh_status",
      "layer": "wordpress",
      "kind": "hook",
      "title": "woocommerce_order_action_gstore_blu_refresh_status"
    },
    {
      "id": "wp:hook:woocommerce_blocks_payment_method_type_registration",
      "layer": "wordpress",
      "kind": "hook",
      "title": "woocommerce_blocks_payment_method_type_registration"
    },
    {
      "id": "wp:hook:woocommerce_shipping_methods",
      "layer": "wordpress",
      "kind": "hook",
      "title": "woocommerce_shipping_methods (filter)"
    },
    {
      "id": "wp:hook:woocommerce_package_rates",
      "layer": "wordpress",
      "kind": "hook",
      "title": "woocommerce_package_rates (filter)"
    },
    {
      "id": "wp:hook:woocommerce_checkout_update_order_review",
      "layer": "wordpress",
      "kind": "hook",
      "title": "woocommerce_checkout_update_order_review"
    },
    {
      "id": "wp:hook:woocommerce_shortcode_products_query",
      "layer": "wordpress",
      "kind": "hook",
      "title": "woocommerce_shortcode_products_query (filter)"
    },
    {
      "id": "wp:hook:woocommerce_product_query",
      "layer": "wordpress",
      "kind": "hook",
      "title": "woocommerce_product_query"
    },
    {
      "id": "wp:hook:render_block",
      "layer": "wordpress",
      "kind": "hook",
      "title": "render_block (filter)"
    },
    {
      "id": "wp:hook:render_block_core/html",
      "layer": "wordpress",
      "kind": "hook",
      "title": "render_block_core/html (filter)"
    },
    {
      "id": "wp:hook:render_block_core/template-part",
      "layer": "wordpress",
      "kind": "hook",
      "title": "render_block_core/template-part (filter)"
    },
    {
      "id": "wp:hook:render_block_core/image",
      "layer": "wordpress",
      "kind": "hook",
      "title": "render_block_core/image (filter)"
    },

    {
      "id": "php:subsystem:frontend_assets",
      "layer": "php",
      "kind": "subsystem",
      "title": "Frontend Assets (enqueues)",
      "summary": "Enfileira CSS/JS do tema (inclui category-filter) no wp_enqueue_scripts.",
      "details": {
        "entrypoints": ["gstore_enqueue_styles", "gstore_enqueue_scripts"],
        "notes": "O tema enfileira diversos CSS/JS; aqui destacamos o filtro de categorias como subsistema visível."
      },
      "tags": ["frontend", "assets"]
    },
    {
      "id": "wp:asset:assets/css/category-filter.css",
      "layer": "wordpress",
      "kind": "asset",
      "title": "category-filter.css",
      "path": "assets/css/category-filter.css",
      "summary": "Estilos do filtro de categorias estilo marketplace."
    },
    {
      "id": "wp:asset:assets/js/category-filter.js",
      "layer": "wordpress",
      "kind": "asset",
      "title": "category-filter.js",
      "path": "assets/js/category-filter.js",
      "summary": "JS do filtro de categorias (chips, tree expand/collapse, apply/clear)."
    },

    {
      "id": "php:file:inc/class-gstore-category-filter.php",
      "layer": "php",
      "kind": "file",
      "title": "Category Filter (PHP)",
      "path": "inc/class-gstore-category-filter.php",
      "summary": "Intercepta o bloco woocommerce/product-categories e aplica filtro de categorias na query.",
      "tags": ["frontend", "woocommerce", "filters"]
    },
    {
      "id": "php:class:GStore_Category_Filter",
      "layer": "php",
      "kind": "class",
      "title": "GStore_Category_Filter",
      "path": "inc/class-gstore-category-filter.php",
      "summary": "Filtro de categorias estilo marketplace (árvore multi-select) com querystring filter_cat[]."
    },

    {
      "id": "php:file:inc/class-gstore-store-info.php",
      "layer": "php",
      "kind": "file",
      "title": "Store Info (classe)",
      "path": "inc/class-gstore-store-info.php",
      "summary": "Classe singleton que lê/salva informações da loja em store-info.json (estrutura validada).",
      "tags": ["config", "json"]
    },
    {
      "id": "php:class:GStore_Store_Info",
      "layer": "php",
      "kind": "class",
      "title": "GStore_Store_Info",
      "path": "inc/class-gstore-store-info.php",
      "summary": "API interna para get_value/set_value/export/import do store-info.json."
    },
    {
      "id": "wp:asset:store-info.json",
      "layer": "wordpress",
      "kind": "asset",
      "title": "store-info.json",
      "path": "store-info.json",
      "summary": "Dados centralizados da loja (store/contact/address/social/footer/meta/branding).",
      "tags": ["config"]
    },
    {
      "id": "php:subsystem:store_info_placeholders",
      "layer": "php",
      "kind": "subsystem",
      "title": "Store Info Placeholders",
      "summary": "Processa placeholders {{store_name}}, {{whatsapp_link}}, etc. via render_block + output buffer; lê dados do store-info.json.",
      "details": {
        "placeholdersPrefix": "{{...}}",
        "buffering": { "startHook": "template_redirect", "endHook": "shutdown" }
      },
      "tags": ["frontend", "placeholders"]
    },

    {
      "id": "wp:admin_page:gstore-settings",
      "layer": "wordpress",
      "kind": "admin_page",
      "title": "Configurações Gstore",
      "summary": "Aparência → Configurações Gstore (hero slider, banners, logo, store-info export/import, sync Git).",
      "details": { "slug": "gstore-settings", "screenId": "appearance_page_gstore-settings" },
      "tags": ["admin"]
    },
    {
      "id": "wp:admin_post:gstore_export_store_info",
      "layer": "wordpress",
      "kind": "endpoint",
      "title": "admin-post export store-info",
      "summary": "POST /wp-admin/admin-post.php?action=gstore_export_store_info"
    },
    {
      "id": "wp:admin_post:gstore_import_store_info",
      "layer": "wordpress",
      "kind": "endpoint",
      "title": "admin-post import store-info",
      "summary": "POST /wp-admin/admin-post.php?action=gstore_import_store_info"
    },

    {
      "id": "php:file:inc/class-gstore-blu-payment-gateway.php",
      "layer": "php",
      "kind": "file",
      "title": "Blu Checkout Gateway",
      "path": "inc/class-gstore-blu-payment-gateway.php",
      "summary": "Gateway WooCommerce 'blu_checkout' (checkout por link) + webhook REST + ação manual no pedido.",
      "tags": ["woocommerce", "payments", "blu"]
    },
    {
      "id": "php:class:Gstore_Blu_Payment_Gateway",
      "layer": "php",
      "kind": "class",
      "title": "Gstore_Blu_Payment_Gateway",
      "path": "inc/class-gstore-blu-payment-gateway.php",
      "summary": "WC_Payment_Gateway: cria link Blu, salva metas, envia instruções por e-mail e aplica status por webhook."